{
  "id": "secret-read",
  "runId": "20260614194407",
  "stageId": "secret-read",
  "actionType": "secret",
  "resource": ".env",
  "decision": "deny",
  "reason": "Secret access follows the policy default.",
  "policyRuleId": "secrets.default",
  "timestamp": "2026-06-14T19:44:07.095Z",
  "artifactReferences": [
    ".vibeharness/runs/<run_id>/policy-decisions/secret-read.json"
  ]
}
